{
  "schema_version": "1.0",
  "report": {
    "title": "UK Biobank v1.5 VBM reproduction and experimental PyTorch GPU alternative",
    "run_date": "2026-09-24",
    "cohort_description": "Evaluation used ten real T1-weighted scans from one non-UKB clinical cohort. Only cohort aggregates and cohort-mean images are released."
  },
  "study": {
    "all_cases_n": 10,
    "holdout_n": 9,
    "tuning_case": "case01"
  },
  "methods": {
    "reference": {
      "label": "UKB v1.5 structural and VBM commands on FSL 6.0.7.4",
      "description": "The reference follows the published crop, BET, standard-mask, FAST, affine, FNIRT, Jacobian and modulation sequence.",
      "scope": "The original production environment used an older FSL release, so this is a method-level reproduction rather than a bytewise replay."
    },
    "gpu_alternative": {
      "label": "PyTorch GPU raw-T1 VBM alternative",
      "description": "WMH-SynthSeg posteriors estimate GM, followed by multiscale optimization with global normalized correlation + 0.2 MSE, affine and displacement parameters, and Jacobian modulation.",
      "status": "experimental",
      "equivalence": "not_fnirt_equivalent"
    },
    "gdc": {
      "applied": false,
      "reason": "the non-UKB scans had no scanner gradient-coefficient file; the corresponding v1.5 branch uses no gradient correction."
    },
    "geometry_fallback": {
      "applied": true,
      "case_label": "case02",
      "reason": "the original schedule produced an invalid transform and an empty standard-space image for this geometry.",
      "method": "a cropped-to-original FSL scaled-voxel transform derived from the image headers before the remaining reference steps"
    }
  },
  "templates": [
    {
      "id": "ukb_v1_5",
      "label": "UKB v1.5 GM template",
      "role": "official reference template",
      "url": "https://www.fmrib.ox.ac.uk/ukbiobank/fbp/templates/dckr_build/DATA_public.tar.gz",
      "sha256": "ab933db7455d7c4b88624d54f41a3065be4ba4289d00b9230daec0cdb1597a77",
      "distributed": false,
      "source_status": "Extracted from the official ancillary archive; archive SHA-256 is recorded in the method documentation."
    },
    {
      "id": "local_hcp_derived",
      "label": "local HCP-derived GM template",
      "role": "comparison template",
      "url": null,
      "sha256": "2f20eeb19a8f9c3514d1bd1f4d46bca13065ca66bae723721e413688bde9110c",
      "distributed": false,
      "source_status": "Upstream provenance and redistribution terms were not confirmed; it is not described as an official HCP template."
    }
  ],
  "environment": {
    "hardware": {
      "host": "gpucw1",
      "CPU": "Intel Xeon Gold 6430, 128 logical CPUs",
      "GPU": "2 x NVIDIA H100 PCIe, 81559 MiB each",
      "driver": "535.216.03"
    },
    "software": {
      "FSL": "6.0.7.4",
      "Python": "3.11.7",
      "PyTorch": "2.5.1 with CUDA 11.8",
      "nibabel": "5.4.0",
      "NumPy": "1.26.4",
      "SciPy": "1.11.4"
    }
  },
  "timing_definitions": [
    {
      "label": "Shared-node cohort timing",
      "includes": "Observed wall time for each complete method stage, including image I/O. Raw-T1 FSL timing includes crop, brain extraction, standard-mask propagation, FAST, registration, Jacobian and modulation.",
      "excludes": "Gradient correction and downstream UKB stages outside VBM. The node also ran unrelated work, so these values describe the observed run rather than an isolated hardware limit."
    },
    {
      "label": "Matched-input registration timing",
      "includes": "Registration, Jacobian calculation, modulation and image I/O from the identical FAST GM image and UKB template.",
      "excludes": "Raw-T1 preprocessing, brain extraction and GM estimation."
    },
    {
      "label": "Monitored H100 warm timing",
      "includes": "Ten scans processed sequentially on one H100 after a single model load. Monitoring found no competing GPU load during the run; GPU memory was 1,266 MiB before and after and peaked at 4,997 MiB. Per-scan raw-T1 time is GM inference plus registration wall time.",
      "excludes": "The one-time 1.432-second model load, environment setup, template download and weight download."
    },
    {
      "label": "Separate lower-load single-scan timing windows",
      "includes": "The same anonymous holdout scan and official UKB template were used. The CPU value is a successful fresh-output FSL run with continuous stage wall times; 317 ten-second samples had median one-minute system load 13.82 and range 6.69 to 33.78. The GPU values come from a different monitored window and report model load, GM inference and I/O, registration through finalized output, and the saved warm stage sum. Across 79 one-second GPU samples, no competing GPU compute was detected; memory was 1,266 MiB before and after and peaked at 4,997 MiB, while external resident processes were unchanged.",
      "excludes": "The CPU and GPU windows were not simultaneous or paired. The CPU was screened only for lower load before launch. The GPU warm sum excludes model load, downloads and environment setup. No controlled speedup is calculated from these separate windows."
    }
  ],
  "analyses": {
    "all10": {
      "label": "All scans",
      "n": 10,
      "finding": "The UKB template did not improve leave-one-out cohort consistency. FSL favored the local HCP-derived template for warped Pearson, warped Dice and modulated Dice under exact paired-label tests. The fixed template-only mask contained 214,263 2 mm voxels, using the union of template values above 0.01. The GPU template differences were smaller and not significant. With matched FAST GM input, GPU versus FSL mean Pearson was 0.630 for warped GM and 0.553 for modulated GM. Before registration, SynthSeg-derived GM versus FAST GM had median Pearson 0.579, Dice 0.835 and volume ratio 1.008. Every end-to-end GPU registration required whole-field deformation scaling; raw fields contained nonpositive determinants, so valid saved Jacobians are a construction constraint.",
      "metrics": [
        {
          "comparison": "FSL template comparison",
          "metric": "Warped GM: LOO Pearson correlation",
          "statistic": "mean",
          "n": 10,
          "left_label": "UKB",
          "left_value": 0.7056107511416381,
          "right_label": "local HCP-derived",
          "right_value": 0.7275717049696862,
          "difference_label": "UKB minus local HCP-derived",
          "difference_value": -0.02196095382804799,
          "exact_permutation_p": 0.001953125,
          "direction_counts": {
            "left_better": 0,
            "right_better": 10,
            "ties": 0
          },
          "note": "All paired label assignments were enumerated and each assignment rebuilt both leave-one-out references."
        },
        {
          "comparison": "FSL template comparison",
          "metric": "Warped GM: LOO Dice at GM >= 0.5",
          "statistic": "mean",
          "n": 10,
          "left_label": "UKB",
          "left_value": 0.7612488486512822,
          "right_label": "local HCP-derived",
          "right_value": 0.7739673461576316,
          "difference_label": "UKB minus local HCP-derived",
          "difference_value": -0.012718497506349458,
          "exact_permutation_p": 0.001953125,
          "direction_counts": {
            "left_better": 0,
            "right_better": 10,
            "ties": 0
          }
        },
        {
          "comparison": "FSL template comparison",
          "metric": "Modulated GM: LOO Pearson correlation",
          "statistic": "mean",
          "n": 10,
          "left_label": "UKB",
          "left_value": 0.6818499669828602,
          "right_label": "local HCP-derived",
          "right_value": 0.6907316624007401,
          "difference_label": "UKB minus local HCP-derived",
          "difference_value": -0.008881695417880042,
          "exact_permutation_p": 0.17578125,
          "direction_counts": {
            "left_better": 0,
            "right_better": 10,
            "ties": 0
          }
        },
        {
          "comparison": "FSL template comparison",
          "metric": "Modulated GM: LOO Dice at GM >= 0.5",
          "statistic": "mean",
          "n": 10,
          "left_label": "UKB",
          "left_value": 0.7463849043947682,
          "right_label": "local HCP-derived",
          "right_value": 0.7598875816613191,
          "difference_label": "UKB minus local HCP-derived",
          "difference_value": -0.013502677266550767,
          "exact_permutation_p": 0.00390625,
          "direction_counts": {
            "left_better": 0,
            "right_better": 10,
            "ties": 0
          }
        },
        {
          "comparison": "GPU template comparison",
          "metric": "Warped GM: LOO Pearson correlation",
          "statistic": "mean",
          "n": 10,
          "left_label": "UKB",
          "left_value": 0.7082342358745974,
          "right_label": "local HCP-derived",
          "right_value": 0.7127814194695158,
          "difference_label": "UKB minus local HCP-derived",
          "difference_value": -0.00454718359491838,
          "exact_permutation_p": 0.224609375,
          "direction_counts": {
            "left_better": 1,
            "right_better": 9,
            "ties": 0
          },
          "note": "All paired label assignments were enumerated and each assignment rebuilt both leave-one-out references."
        },
        {
          "comparison": "GPU template comparison",
          "metric": "Warped GM: LOO Dice at GM >= 0.5",
          "statistic": "mean",
          "n": 10,
          "left_label": "UKB",
          "left_value": 0.7610028910670144,
          "right_label": "local HCP-derived",
          "right_value": 0.7653993845783286,
          "difference_label": "UKB minus local HCP-derived",
          "difference_value": -0.004396493511314392,
          "exact_permutation_p": 0.0546875,